{
  "$schema": "https://ar-agents.vercel.app/schemas/agents.v1.json",
  "name": "ar-agents-bridge-hello",
  "description": "Demo: Agentic Commerce Bridge — AP2 + ACP + MCP protocol surfaces wired to MercadoPago. Shows cross-jurisdictional interaction (Wyoming DAO LLC ↔ AR sociedad-IA) per cookbook recipe 21. Not a productive sociedad-IA.",
  "homepage": "https://ar-agents-bridge-hello.vercel.app",
  "repository": "https://github.com/ar-agents/ar-agents/tree/main/apps/bridge-hello",
  "license": "MIT",
  "maintainer": {
    "name": "Nazareno Clemente",
    "email": "naza@helloastro.co"
  },
  "issuer": {
    "jurisdiction": "AR",
    "type": "sociedad-ia-demo",
    "operatorName": "Nazareno Clemente",
    "operatorCuit": "20-41758101-5",
    "supervisionRegime": "rfc-001-v1",
    "denominacion": "ar-agents-bridge-hello demo (not a productive sociedad-IA)"
  },
  "rfcConformance": [
    "rfc-001-v1",
    "rfc-002-v1",
    "rfc-003-draft",
    "rfc-004-draft"
  ],
  "auditEndpoints": {
    "auditRead": "https://ar-agents-bridge-hello.vercel.app/api/play/audit/{sessionId}",
    "auditVerify": "https://ar-agents-bridge-hello.vercel.app/api/play/audit/{sessionId}?verify=1"
  },
  "discovery": {
    "canonicalSpec": "https://ar-agents.vercel.app/rfcs/002",
    "testVectors": "https://ar-agents.vercel.app/test-vectors/rfc-004-v1.json",
    "rfc003EnvelopeGenerator": "https://ar-agents.vercel.app/api/rfc-003-envelope?sessionId={sessionId}"
  }
}
